{
    "$schema": "https://json-schema.org/draft/2020-12/schema",
    "$id": "transport-v0.schema.json",
    "type": "object",
    "additionalProperties": false,
    "required": [
        "fixture_version",
        "id",
        "family",
        "profile",
        "description",
        "kind",
        "input",
        "responses",
        "expected"
    ],
    "properties": {
        "fixture_version": {"const": "0"},
        "id": {"type": "string", "pattern": "^transport/openai-chat/[a-z0-9][a-z0-9-]*$"},
        "family": {"const": "transport/openai-chat"},
        "profile": {"const": "core-generation"},
        "description": {"type": "string", "minLength": 1},
        "kind": {"enum": ["adapter", "core_http"]},
        "input": {
            "type": "object",
            "additionalProperties": false,
            "required": ["adapter_config"],
            "properties": {
                "adapter_config": {"type": "object"},
                "wire": {"type": "object"},
                "operation": {"type": "object"}
            }
        },
        "responses": {
            "type": "array",
            "items": {
                "type": "object",
                "additionalProperties": false,
                "required": ["status", "headers", "byte_chunks"],
                "properties": {
                    "status": {"type": "integer", "minimum": 100, "maximum": 599},
                    "headers": {"type": "object", "additionalProperties": {"type": "string"}},
                    "byte_chunks": {
                        "type": "array",
                        "items": {
                            "type": "object",
                            "additionalProperties": false,
                            "required": ["bytes"],
                            "properties": {
                                "bytes": {"type": "string", "contentEncoding": "base64"}
                            }
                        }
                    }
                }
            }
        },
        "expected": {
            "type": "object",
            "additionalProperties": false,
            "required": ["status"],
            "properties": {
                "status": {"enum": ["observed", "to_be_observed"]},
                "http_requests": {
                    "type": "array",
                    "items": {
                        "type": "object",
                        "additionalProperties": false,
                        "required": ["method", "path", "headers", "json", "stream_mode"],
                        "properties": {
                            "method": {"type": "string", "minLength": 1},
                            "path": {"type": "string", "pattern": "^/"},
                            "headers": {
                                "type": "object",
                                "additionalProperties": {"type": "string"}
                            },
                            "json": {},
                            "stream_mode": {"type": "boolean"}
                        }
                    }
                },
                "wire_limits": {
                    "type": "array",
                    "items": {
                        "type": "object",
                        "additionalProperties": false,
                        "required": ["timeout_s", "max_response_bytes"],
                        "properties": {
                            "timeout_s": {"type": "number"},
                            "max_response_bytes": {"type": "integer", "minimum": 0}
                        }
                    }
                },
                "adapter_outcome": {"type": "object"},
                "core": {"type": "object"}
            },
            "allOf": [
                {
                    "if": {"properties": {"status": {"const": "observed"}}, "required": ["status"]},
                    "then": {"required": ["http_requests", "wire_limits"]},
                    "else": {"maxProperties": 1}
                }
            ]
        }
    },
    "allOf": [
        {
            "if": {"properties": {"kind": {"const": "adapter"}}, "required": ["kind"]},
            "then": {
                "properties": {
                    "input": {"required": ["wire"], "not": {"required": ["operation"]}},
                    "expected": {
                        "allOf": [
                            {
                                "if": {"properties": {"status": {"const": "observed"}}, "required": ["status"]},
                                "then": {"required": ["adapter_outcome"], "not": {"required": ["core"]}}
                            }
                        ]
                    }
                }
            }
        },
        {
            "if": {"properties": {"kind": {"const": "core_http"}}, "required": ["kind"]},
            "then": {
                "properties": {
                    "input": {"required": ["operation"], "not": {"required": ["wire"]}},
                    "expected": {
                        "allOf": [
                            {
                                "if": {"properties": {"status": {"const": "observed"}}, "required": ["status"]},
                                "then": {"required": ["core"], "not": {"required": ["adapter_outcome"]}}
                            }
                        ]
                    }
                }
            }
        }
    ]
}
