{
  "fixture_version": "0",
  "id": "transport/openai-chat/outbound-sampling-omitted",
  "family": "transport/openai-chat",
  "profile": "core-generation",
  "description": "A buffered direct wire request has an empty sampling object so native payload construction omits all sampling controls.",
  "kind": "adapter",
  "input": {
    "adapter_config": {
      "provider_id": "openai-compat",
      "base_url": "https://fixture.invalid/v1",
      "api_key": "fixture-token",
      "headers": {
        "x-fixture": "transport"
      },
      "timeout_s": 120
    },
    "wire": {
      "model": "fixture-model",
      "messages": [
        {
          "role": "user",
          "text": "Hello."
        }
      ],
      "sampling": {},
      "mechanism": null,
      "stream": false,
      "timeout_s": 120,
      "max_response_bytes": 1048576
    }
  },
  "responses": [
    {
      "status": 200,
      "headers": {
        "content-type": "application/json"
      },
      "byte_chunks": [
        {
          "bytes": "eyJjaG9pY2VzIjpbeyJtZXNzYWdlIjp7ImNvbnRlbnQiOiJkZWZhdWx0In0sImZpbmlzaF9yZWFzb24iOiJzdG9wIn1dfQ=="
        }
      ]
    }
  ],
  "expected": {
    "status": "to_be_observed"
  }
}
