{
  "fixture_version": "0",
  "id": "transport/openai-chat/done-sentinel",
  "family": "transport/openai-chat",
  "profile": "core-generation",
  "description": "The OpenAI DONE sentinel terminates a stream even when later bytes contain another data record.",
  "kind": "adapter",
  "input": {
    "adapter_config": {
      "provider_id": "openai-compat",
      "base_url": "https://fixture.invalid/v1",
      "api_key": "fixture-token",
      "headers": {
        "x-fixture": "transport"
      },
      "timeout_s": 120
    },
    "wire": {
      "model": "fixture-model",
      "messages": [
        {
          "role": "user",
          "text": "Hello."
        }
      ],
      "sampling": {},
      "mechanism": null,
      "stream": true,
      "timeout_s": 120,
      "max_response_bytes": 1048576
    }
  },
  "responses": [
    {
      "status": 200,
      "headers": {
        "content-type": "text/event-stream"
      },
      "byte_chunks": [
        {
          "bytes": "ZGF0YTogeyJjaG9pY2VzIjpbeyJkZWx0YSI6eyJjb250ZW50Ijoia2VwdCJ9fV19CgpkYXRhOiBbRE9ORV0KCmRhdGE6IHsiY2hvaWNlcyI6W3siZGVsdGEiOnsiY29udGVudCI6Imlnbm9yZWQifX1dfQoK"
        }
      ]
    }
  ],
  "expected": {
    "status": "to_be_observed"
  }
}
