{
  "fixture_version": "0",
  "id": "transport/openai-chat/raw-byte-cap-multibyte-utf8",
  "family": "transport/openai-chat",
  "profile": "core-generation",
  "description": "A streamed multibyte UTF-8 response exceeds the raw byte cap although its decoded content has no more characters than the cap.",
  "kind": "adapter",
  "input": {
    "adapter_config": {
      "provider_id": "openai-compat",
      "base_url": "https://fixture.invalid/v1",
      "api_key": "fixture-token",
      "headers": {
        "x-fixture": "transport"
      },
      "timeout_s": 120
    },
    "wire": {
      "model": "fixture-model",
      "messages": [
        {
          "role": "user",
          "text": "Hello."
        }
      ],
      "sampling": {},
      "mechanism": null,
      "stream": true,
      "timeout_s": 120,
      "max_response_bytes": 147
    }
  },
  "responses": [
    {
      "status": 200,
      "headers": {
        "content-type": "text/event-stream"
      },
      "byte_chunks": [
        {
          "bytes": "ZGF0YTogeyJjaG9pY2VzIjpbeyJkZWx0YSI6eyJjb250ZW50Ijoiw6nDqcOpw6nDqcOpw6nDqcOpw6nDqcOpw6nDqcOpw6nDqcOpw6nDqcOpw6nDqcOpw6nDqcOpw6nDqcOpIn19XX0KCmRhdGE6IHsiY2hvaWNlcyI6W3siZGVsdGEiOnt9LCJmaW5pc2hfcmVhc29uIjoic3RvcCJ9XX0KCmRhdGE6IFtET05FXQoK"
        }
      ]
    }
  ],
  "expected": {
    "status": "to_be_observed"
  }
}
